{
  "contract_version": "smart_wallet_registry.v1",
  "generated_at": "1970-01-01T00:00:00Z",
  "input_summary": {
    "duplicates_removed": 0,
    "invalid_rows": 0,
    "total_rows_seen": 0,
    "valid_wallets": 0
  },
  "registry_summary": {
    "active_count": 0,
    "kept_wallets": 0,
    "rejected_wallets": 0,
    "tier_1_count": 0,
    "tier_2_count": 0,
    "tier_3_count": 0,
    "total_candidates": 0,
    "watch_count": 0
  },
  "wallets": []
}
